Title,Price,Rating,Address,Img_URL,Description,Rank_of_province,Link_Transfer
Halong bay day and overnight package,-1,5.0,-1,https://media-cdn.tripadvisor.com/media/attractions-splice-spp-720x480/0f/12/5b/46.jpg,Chúng tôi đã được giới thiệu để đặt chuyến tham quan vịnh hạ Long với Elise Lullaby travel. Mọi thứ diễn ra thật tuyệt vời . Rất cảm ơn Elise và đội ngũ nhân viên tàu,Số 19 trên 224 Lớp học & hội thảo ở Hà Nội,https://www.tripadvisor.com.vn/Attraction_Review-g293924-d18921685-Reviews-Halong_bay_day_and_overnight_package-Hanoi.html
La Pinta Cruises,-1,5.0,-1,https://dynamic-media-cdn.tripadvisor.com/media/photo-o/15/7e/57/6c/drone-shot-of-the-cruise.jpg?w=1200&h=-1&s=1,Chuyến đi khá vui với bạn bè. Hướng dẫn viên và phụ vụ rất nhiệt tình. Cảnh thì thôi khỏi nói 🥰. Đồ ăn rất hợp vị mình. Có dịp rất muốn dẫn gia đi mình đi 1 chuyến.,Số 9 trên 83 Phương tiện giao thông ở Vịnh Hạ Long,https://www.tripadvisor.com.vn/Attraction_Review-g293923-d19117258-Reviews-La_Pinta_Cruises-Halong_Bay_Quang_Ninh_Province.html
Hanoi Biking Travel,-1,5.0,-1,https://dynamic-media-cdn.tripadvisor.com/media/photo-o/04/75/cd/e1/getlstd-property-photo.jpg?w=500&h=400&s=1,"Có rất nhiều bạn trẻ năng động sẽ cùng bạn khám phá Hà Nội cổ dưới 1 góc nhìn rất đặc trưng, đi vào các ngõ nhỏ của phố cổ. Hơn nữa nó thú vị và giúp bạn vận động vafcungx bảo vệ môi trường nữa",Số 28 trên 494 Phương tiện giao thông ở Hà Nội,https://www.tripadvisor.com.vn/Attraction_Review-g293924-d4783795-Reviews-Hanoi_Biking_Travel-Hanoi.html
Asia Exotica Indochina,-1,5.0,-1,https://media-cdn.tripadvisor.com/media/attractions-splice-spp-720x480/0f/f8/6f/76.jpg,"The experience in Cambodia has been unforgettable. The Travel Agency, Asia Exotica Cambodia, has been wonderful. Thanks to Ly, the representative of the agency's local team (customer care team).
We also want to thank the attention given to us by our local guide, Mr. Phally, an exceptional, loving and attentive person. He was always very punctual and, at all times, attentive to us and our needs.",Số 17 trên 494 Phương tiện giao thông ở Hà Nội,https://www.tripadvisor.com.vn/Attraction_Review-g293924-d25178358-Reviews-Asia_Exotica_Indochina-Hanoi.html
Hoi An Discovery Tour,-1,-1,-1,https://dynamic-media-cdn.tripadvisor.com/media/photo-o/0f/bc/6c/7e/hoi-an-ancient-town.jpg?w=900&h=600&s=1,-1,Số 55 trên 187 Phương tiện giao thông ở Hội An,https://www.tripadvisor.com.vn/Attraction_Review-g298082-d12593963-Reviews-Hoi_An_Discovery_Tour-Hoi_An_Quang_Nam_Province.html
Hanoi Transportation Service,-1,5.0,"28 Hàng Hành street, Hà Nội 100000 Việt Nam",https://dynamic-media-cdn.tripadvisor.com/media/photo-o/18/5a/7f/d5/hanoi-transportation.jpg?w=900&h=600&s=1,"We recently visited Hanoi, we were able to easily book this service, The staff were amazing with our young son, and the company catered all our needs. We highly recommend this service for anyone visiting Hanoi",Số 115 trên 494 Phương tiện giao thông ở Hà Nội,https://www.tripadvisor.com.vn/Attraction_Review-g293924-d17750736-Reviews-Hanoi_Transportation_Service-Hanoi.html
Signature Journey - Cat Ba island,-1,5.0,-1,-1,"Hướng dẫn viên vui vẻ, nhiệt tình, cảnh quan và bãi tắm đẹp. Đồ ăn trưa được. Đủ các hoạt động bơi, kayak...",Số 1 trên 24 Phương tiện giao thông ở Cát Bà,https://www.tripadvisor.com.vn/Attraction_Review-g737051-d15687862-Reviews-Signature_Journey_Cat_Ba_island-Cat_Ba_Hai_Phong.html
Saco Travel - Top Brands Asia Pacific,-1,5.0,-1,-1,"Xe rộng đặc biệt là rất thơm, trong đoàn ai cũng khen. Anh tài xế dễ thương còn hỗ trợ các lịch trình phát sinh. điểm 10 chất lượng",Số 7 trên 273 Phương tiện giao thông ở Thành phố Hồ Chí Minh,https://www.tripadvisor.com.vn/Attraction_Review-g293925-d23470134-Reviews-Saco_Travel_Top_Brands_Asia_Pacific-Ho_Chi_Minh_City.html
Phong Nha Transfers,-1,5.0,-1,-1,"We had an amazing day with Tien travelling from Phong Nha to Ninh Binh. He was friendly, helpful, very safe and experienced driver. He took us to some beautiful spots along the way for food, drinks and photos. He made us feel very comfortable, bought us water and made regular stops so we didn’t have to think about anything. Very hot the day we went and great to have a cool air-conditioned car to go back to. Thank you so much for a great day, Tien! Would definately recommend Phong Nha Transfers to others.",Số 4 trên 7 Phương tiện giao thông ở Vườn quốc gia Phong Nha-Kẻ Bàng,https://www.tripadvisor.com.vn/Attraction_Review-g4014591-d12952604-Reviews-Phong_Nha_Transfers-Phong_Nha_Ke_Bang_National_Park_Quang_Binh_Province.html
Inbound Vietnam Travel,-1,5.0,-1,-1,-1,Số 40 trên 494 Phương tiện giao thông ở Hà Nội,https://www.tripadvisor.com.vn/Attraction_Review-g293924-d23511268-Reviews-Inbound_Vietnam_Travel-Hanoi.html
Truong Sa Tourist,-1,5.0,-1,https://dynamic-media-cdn.tripadvisor.com/media/photo-o/28/e3/2f/92/ba-na-hills-i-really.jpg?w=1200&h=-1&s=1,"Mình đã có những trải nghiệm rất tuyệt vời khi đến với Đà Nẵng, nhân viên công ty hỗ trợ mình rát chu đáo và nhiệt tình.",Số 8 trên 215 Phương tiện giao thông ở Đà Nẵng,https://www.tripadvisor.com.vn/Attraction_Review-g298085-d18189861-Reviews-Truong_Sa_Tourist-Da_Nang.html
Sunny Ha Giang Loop,-1,5.0,-1,-1,"Die Tour hat meine Erwartungen übertroffen! Wir waren in einer Gruppe zu viert unterwegs (was sehr angenehm war, weil nicht zu groß) mit unserem Guide Monkey, der hervorragend Englisch sprach, extrem witzig und hilfsbereit war. Er hat uns auch auf kleinere Wege abseits der Hauptstraße geführt, wo wir komplett alleine eindrucksvolle Aussichten genießen konnten. Die Driver waren auch sehr freundlich und zuvorkommend, wir haben uns immer gut aufgehoben gefühlt und tolle Abende verbracht. Die Unterkünfte, das Essen und die Ausrüstung waren perfekt. Sunny hat uns auch die Rückfahrt nach Hanoi organisiert.",Số 4 trên 49 Phương tiện giao thông ở Hà Giang,https://www.tripadvisor.com.vn/Attraction_Review-g1544599-d18898420-Reviews-Sunny_Ha_Giang_Loop-Ha_Giang_Ha_Giang_Province.html
Authentic HALONG,-1,4.5,-1,https://dynamic-media-cdn.tripadvisor.com/media/photo-o/1a/19/2c/87/caption.jpg?w=1100&h=1100&s=1,"The boat is new and very clean. The surroundings are amazing and you really cannot get enough of the horizon.

Overall the crew is amazing! Davis was our designated waiter and did an amazing job. We were never thirsty, thanks Davis!",Số 12 trên 83 Phương tiện giao thông ở Vịnh Hạ Long,https://www.tripadvisor.com.vn/Attraction_Review-g293923-d19481011-Reviews-Authentic_HALONG-Halong_Bay_Quang_Ninh_Province.html
Halong Bay Taxi,-1,5.0,-1,https://dynamic-media-cdn.tripadvisor.com/media/photo-o/26/81/bd/fd/caption.jpg?w=900&h=600&s=1,Dịch vụ nhanh chóng. rất chuẩn giờ. Mình được bạn gọi giúp xe bên này thấy lái xe lịch sự . Xe sạch sẽ và giá cả thì rẻ cả hơn grapcar,Số 28 trên 83 Phương tiện giao thông ở Vịnh Hạ Long,https://www.tripadvisor.com.vn/Attraction_Review-g293923-d25073021-Reviews-Halong_Bay_Taxi-Halong_Bay_Quang_Ninh_Province.html
Indochina Charm Travel (HCMC Branch),-1,4.5,-1,https://dynamic-media-cdn.tripadvisor.com/media/photo-o/16/58/b7/02/caption.jpg?w=1000&h=1000&s=1,"After a long day of travel it was so convenient to be greeted by Vu on our arrival at HCM. He was polite, helpful and we felt very safe and comfortable with his driving. Large clean car.
Definitely recommend this service with the added bonus that it is more affordable than booking through hotel.",Số 13 trên 273 Phương tiện giao thông ở Thành phố Hồ Chí Minh,https://www.tripadvisor.com.vn/Attraction_Review-g293925-d16159007-Reviews-Indochina_Charm_Travel_HCMC_Branch-Ho_Chi_Minh_City.html
Pu Luong Transfer Service,-1,-1,-1,https://dynamic-media-cdn.tripadvisor.com/media/photo-o/1b/76/41/69/pu-luong-transfer-service.jpg?w=800&h=500&s=1,-1,Số 1 trên 1 Phương tiện giao thông ở Thanh Lam,https://www.tripadvisor.com.vn/Attraction_Review-g12616458-d19863530-Reviews-Pu_Luong_Transfer_Service-Thanh_Lam_Pu_Long_Nature_Reserve_Thanh_Hoa_Province.html
Vietnam Tour Local,-1,5.0,-1,https://media-cdn.tripadvisor.com/media/attractions-splice-spp-720x480/0e/bb/5b/1b.jpg,-1,Số 4 trên 273 Phương tiện giao thông ở Thành phố Hồ Chí Minh,https://www.tripadvisor.com.vn/Attraction_Review-g293925-d24046387-Reviews-Vietnam_Tour_Local-Ho_Chi_Minh_City.html
Ninh Binh Transfer Service,-1,5.0,-1,https://dynamic-media-cdn.tripadvisor.com/media/photo-o/29/74/38/af/caption.jpg?w=800&h=500&s=1,"Tommy, thank you so much for taking care of us so well. We felt so safe with your team Mr Chi and Mr Phuong, both lovely people and such safe, calm drivers.

Thank you all for your care and time. We can’t recommend Tommys services enough, it’s like having a friend in a foreign place.",Số 3 trên 7 Phương tiện giao thông ở Ninh Hai,https://www.tripadvisor.com.vn/Attraction_Review-g12866457-d25053766-Reviews-Ninh_Binh_Transfer_Service-Ninh_Hai_Hoa_Lu_District_Ninh_Binh_Province.html
boutiquehaspa,-1,5.0,-1,https://dynamic-media-cdn.tripadvisor.com/media/photo-o/1a/80/78/e6/caption.jpg?w=800&h=600&s=1,"Tôi rất ít khi đi mát xa . Haizzz . Dc ông bạn chỉ tới cơ sở mát xa này. Thực ra bản thân không thích mát xa. Chỉ thích tập gym, nên hum trước vừa tập gym xong mêt mỏi, đau ê ẩm dc ông bạn rủ đi. Thì đồng ý thui. Vào cơ sở dc gặp Mr Trung , a ta rất vui tính , khi vào nên gọi a ta là handsome man. . Dc a tư vấn với strong massage để giãn cơ và giúp cơ bắp dc kéo căng giải phóng dc các đám rối ở cơ bắp hay nút thắt do tập luyện. Nghe vậy thui, đã thích tai rui. Khi làm mới biết thế nào là massage chuyên nghiệp. Đi các đường cơ rất tốt, bấm huyệt rất chuẩn. Haha. M là hlv gym nên đánh giá kỹ thuật và lực rất tốt. Nhân viên thân thiện, m là ng bắc nghe gái nam đã thấy kết rùi. Tui đánh giá rất cao cơ sở này. Hãy trải nghiệm và cảm nhận nhé. Thank Handsome Man Mr Trung rất nhiều và các bạn nhân viên tại cơ sở Boutiquehaspa.",Số 10 trên 54 Phương tiện giao thông ở Đảo Phú Quốc,https://www.tripadvisor.com.vn/Attraction_Review-g469418-d19830793-Reviews-Boutiquehaspa-Phu_Quoc_Island_Kien_Giang_Province.html
Hue Booking Tour,-1,5.0,-1,-1,"Unser Tagesausflug von Hoi An nach Hue mit Herrn Ha Thanh war einer der besten und interessantesten die wir bisher hatten.
Der ganze Tag war super organisiert und auch unser Fahrer war sehr freundlich und geübt, im doch recht chaotischen Verkehr Vietnams.
Herr Ha ist wirklich sehr nett und hilfsbereit und spricht sehr gutes Englisch.
Wir würden jederzeit ohne zu zögern wieder eine Tour mit ihm buchen.

Danke Mr Ha Thanh für diesen tollen Tag! :-)",Số 10 trên 107 Phương tiện giao thông ở Huế,https://www.tripadvisor.com.vn/Attraction_Review-g293926-d8445287-Reviews-Hue_Booking_Tour-Hue_Thua_Thien_Hue_Province.html
SAIGONESE TREKKING HOUSE,-1,5.0,-1,https://media-cdn.tripadvisor.com/media/attractions-splice-spp-720x480/10/5a/31/3f.jpg,"Mọi người ơi! mọi người ơi! Mọi người hãy ủng hộ anh chủ Saigonese nhé - Anh chủ vui tính và hâm lắm, chắc hẳn chuyến đi của các bạn sẽ thú vị thêm đấy.",Số 1 trên 11 Đồ ăn & Đồ uống ở Sapa,https://www.tripadvisor.com.vn/Attraction_Review-g311304-d19767896-Reviews-SAIGONESE_TREKKING_HOUSE-Sapa_Lao_Cai_Province.html
Go2muine,-1,5.0,-1,https://dynamic-media-cdn.tripadvisor.com/media/photo-o/25/a8/33/86/caption.jpg?w=900&h=600&s=1,"Prebook our trips thru texting before we left for Vietnam, the company arranged our car trips from Dalat to Mui Ne and from Mui Ne to HCMC. Drivers were on time and drove safely on both occasion. We’ll book car trips again when we visit Vietnam next time",Số 1 trên 1 Phương tiện giao thông ở Ham Tien,https://www.tripadvisor.com.vn/Attraction_Review-g13172842-d24972381-Reviews-Go2muine-Ham_Tien_Phan_Thiet_Binh_Thuan_Province.html
TM Travel,-1,5.0,"121 Bui Thi Xuan, Hà Nội 100000 Việt Nam",https://dynamic-media-cdn.tripadvisor.com/media/photo-o/12/f1/de/55/tm-travel.jpg?w=900&h=600&s=1,こちらの要望をしっかり聞いて下さり、オリジナルなツアーをアレンジしてくれます。他の旅行会社とは、一味違う内容なども提案してくれます。日本人の細かな配慮が嬉しい！何度もリピしています。,Số 138 trên 494 Phương tiện giao thông ở Hà Nội,https://www.tripadvisor.com.vn/Attraction_Review-g293924-d14074250-Reviews-TM_Travel-Hanoi.html
Aio Travel Vietnam - Pakage Tour,-1,5.0,-1,https://media-cdn.tripadvisor.com/media/attractions-splice-spp-720x480/09/49/fb/48.jpg,"Great trip in Vietnam with Aio Travel Vietnam pakage tour.
Amazing Danang 4 days and Halong bay Dragon bay cruise 2 days 1 night exploring Lan Ha Bay before Tam Coc - Hoa Lu in Ninh Binh.
They also orgenize great airport transfer on last day.
All in one and all were well with us,
Thanks Albert and team,",Số 38 trên 494 Phương tiện giao thông ở Hà Nội,https://www.tripadvisor.com.vn/Attraction_Review-g293924-d15539359-Reviews-Aio_Travel_Vietnam_Pakage_Tour-Hanoi.html
Ha Giang loop tour 1,-1,5.0,-1,https://media-cdn.tripadvisor.com/media/attractions-splice-spp-720x480/07/9d/fb/87.jpg,Có trải nghiệm tuyệt vời cùng bạn Đại Ha Giang loop tour 1. Lịch trình hợp lí cảnh sắc đẹp tour guide thân thiện,Số 6 trên 49 Phương tiện giao thông ở Hà Giang,https://www.tripadvisor.com.vn/Attraction_Review-g1544599-d17555762-Reviews-Ha_Giang_loop_tour_1-Ha_Giang_Ha_Giang_Province.html
Hanoi Backstreet Vespa Tours,-1,5.0,-1,https://media-cdn.tripadvisor.com/media/attractions-splice-spp-720x480/11/85/e0/fc.jpg,"The night tour was so fun! We would not have known the spots we were brought to if not for the tour. Han, our guide, told us background stories that were very informative.",Số 1 trên 9 Chuyến tham quan & hoạt động ở Long Bien,https://www.tripadvisor.com.vn/Attraction_Review-g21333608-d26325028-Reviews-Hanoi_Backstreet_Vespa_Tours-Long_Bien_Hanoi.html
Ninh Binh Travel Booking Office,-1,5.0,-1,https://media-cdn.tripadvisor.com/media/attractions-splice-spp-720x480/09/8d/12/e4.jpg,"Dịch vụ hoàn hảo, chúng tôi đã trải nghiệm tour và dịch vụ của văn phòng vé lần trở lại này, chúng tôi tiếp tục lựa chọn văn phòng Ninh Bình travel Office để đặt dịch vụ tiếp, hơn cả mong đợi và chúng tôi rất hài lòng về chất lượng dịch vụ tại đây",Số 1 trên 8 Giải trí về đêm ở Ninh Bình,https://www.tripadvisor.com.vn/Attraction_Review-g303945-d19243560-Reviews-Ninh_Binh_Travel_Booking_Office-Ninh_Binh_Ninh_Binh_Province.html
HTS Travel,-1,5.0,-1,https://dynamic-media-cdn.tripadvisor.com/media/photo-o/29/88/fa/e4/hts-travel.jpg?w=1200&h=900&s=1,"Excellent service great car and driver
Easy to book with WhatsApp
Would highly recommend
Thanks 🙏
See you next year",Số 33 trên 494 Phương tiện giao thông ở Hà Nội,https://www.tripadvisor.com.vn/Attraction_Review-g293924-d19701173-Reviews-HTS_Travel-Hanoi.html
Explore Vietnam,-1,-1,-1,-1,-1,-1,https://www.tripadvisor.com.vn/Attraction_Review-g293926-d24102735-Reviews-Explore_Vietnam-Hue_Thua_Thien_Hue_Province.html
TIMELINE TRAVEL,-1,5.0,-1,-1,Tuyệt vời. Chúng tôi đã đến và trải nghiệm dịch vụ của các bạn. Bạn rất nhiệt tình . Hy vọng lần tới sẽ quay lại và dùng dịch vụ bên bạn.,Số 43 trên 494 Phương tiện giao thông ở Hà Nội,https://www.tripadvisor.com.vn/Attraction_Review-g293924-d24112948-Reviews-TIMELINE_TRAVEL-Hanoi.html
Danang Transfer,-1,4.5,-1,-1,"DỊCH VỤ THUÊ XE TỐT NHẤT MÀ MÌNH TỪNG TRẢI NGHIỆM TẠI ĐÀ NẴNG
mình ở nước ngoài đợt giữa tháng 5 vừa rồi có đặt xe 4 chỗ để đi trải nghiệm các khu du lịch ở Đà Nẵng. Dịch vụ xe rất chuyên nghiệp, anh tài xế tốt bụng vì mình ko biết chỗ nào ăn ngon, anh chở đi ăn Bún Cá rất ngon luôn.
Cám ơn dịch vụ rất nhiều, lần sau mình quay lại Đà nẵng nhất định sẽ thuê xe ở đây, giá cả phải chăng, xe mới toanh, tài xế rất nhiệt tình, hòa đồng, vui vẻ.
Nhờ dịch vụ bên này mà mình có một chuyến du lịch Đà Nẵng rất tuyệt vời",Số 19 trên 215 Phương tiện giao thông ở Đà Nẵng,https://www.tripadvisor.com.vn/Attraction_Review-g298085-d13921265-Reviews-Danang_Transfer-Da_Nang.html
Danang Backstreet Food Tour,-1,5.0,-1,-1,"Chuyến đi khám phá ẩm thực rất tuyệt vời. Gia đình tôi có trẻ nhỏ các bạn ấy rất thích thú với các món ăn địa phương tại đây, mỗi món mang một màu sắc ẩm thực khác nhau, đặc sắc và rất phong phú!!! Cảm ơn rất nhiều ng đã thiết kế ra chuyến đi này!!!",Số 11 trên 215 Phương tiện giao thông ở Đà Nẵng,https://www.tripadvisor.com.vn/Attraction_Review-g298085-d17559552-Reviews-Danang_Backstreet_Food_Tour-Da_Nang.html
MTCarsTravel,-1,5.0,-1,https://dynamic-media-cdn.tripadvisor.com/media/photo-o/13/1f/99/64/mt-travel.jpg?w=900&h=600&s=1,"We had a great transfer from our hotel in Hoi An to Hue. We stopped at marble mountain, Hai Van Pass and Long beach, he also added in an extra stop to see a working fishing village as we had expressed an interest. An excellent guide who knows around Hue very well.",Số 28 trên 107 Phương tiện giao thông ở Huế,https://www.tripadvisor.com.vn/Attraction_Review-g293926-d14124176-Reviews-MTCarsTravel-Hue_Thua_Thien_Hue_Province.html
Tour Ngày Du Lịch Hòn Ngọc Châu Á & Hướng Dẫn,-1,5.0,-1,https://dynamic-media-cdn.tripadvisor.com/media/photo-o/27/e2/20/33/caption.jpg?w=1200&h=900&s=1,"He was nice and spoke good English, explained to us very well all about the culture and history of the area. The tour was very well arranged and the places to see were at a good pace. We had a good time thanks to Lucas and the driver. Highly recommend Lucas when you go to Hue.",Số 16 trên 187 Phương tiện giao thông ở Hội An,https://www.tripadvisor.com.vn/Attraction_Review-g298082-d9721935-Reviews-Asia_Pearl_Travel_Day_Tour_Guides-Hoi_An_Quang_Nam_Province.html
Habana Spa & Nail,-1,5.0,-1,https://media-cdn.tripadvisor.com/media/attractions-splice-spp-720x480/09/8f/f9/95.jpg,"Quán sạch đep, nhân viên thân thiện , massage chuyên nghiệp . Quá hài lòng khi trải nghiệm tại đây . Sẽ quay lại khi có dịp",Số 15 trên 187 Phương tiện giao thông ở Hội An,https://www.tripadvisor.com.vn/Attraction_Review-g298082-d19248964-Reviews-Habana_Spa_Nail-Hoi_An_Quang_Nam_Province.html
Le Journey Halong Cruise,-1,4.5,-1,https://dynamic-media-cdn.tripadvisor.com/media/photo-o/29/f6/5a/6c/caption.jpg?w=1200&h=900&s=1,"Thật tuyệt vời, chuyến đi giúp tôi có những trãi nghiệm thú vị, gặp được những người đồng hành đáng quý. Có một chút vấn đê về phòng nghỉ nhưng không đáng kể, hướng dẫn viên và các chú nhân viên hỗ trợ xử lý nhiệt tình!

Cảm ơn anh tour guide rất nhiều.!!",Số 13 trên 83 Phương tiện giao thông ở Vịnh Hạ Long,https://www.tripadvisor.com.vn/Attraction_Review-g293923-d24976637-Reviews-Le_Journey_Halong_Cruise-Halong_Bay_Quang_Ninh_Province.html
Đà Nẵng Airport Transfer,-1,4.5,-1,https://dynamic-media-cdn.tripadvisor.com/media/photo-o/0e/8a/95/8a/da-n-ng-airport-transfer.jpg?w=1200&h=900&s=1,"Mình bay từ HN vào ĐN tầm 1h chiều. Hôm đó (06/04) thời tiết có nắng nhẹ, khác hẳn so với thời tiết mưa to ở sân bay quốc tế nội bài. Chắc có thể do lúc mình xuống tầm trưa nên ở đây khá yên tĩnh, vắng người. Cũng như bao sân bay khác, nơi đây rộng lớn, khung cảnh đẹp, không khí trong lành. Nhưng có gì đó rất riêng của Đà Nẵng, giọng nói rất hay, thức ăn không quá đắt so với sân bay khác.
Ngày mình về HN, hôm đó (09/04) trời râm, không nắng, cũng không mưa. Mình đến sân bay lúc 9h sáng. Vẫn rất ấn tượng với giọng nói hay, trời mưa lúc sáng sớm nhưng ở đây vẫn rất sạch sẽ. Nói chung là mình yêu Đà Nẵng từ nơi mình đặt chân đầu tiên trên đất này là sân bay Đà Nẵng ❤",Số 20 trên 215 Phương tiện giao thông ở Đà Nẵng,https://www.tripadvisor.com.vn/Attraction_Review-g298085-d12171155-Reviews-Danang_Airport_Transfer-Da_Nang.html
Saigonbiketours,-1,5.0,-1,https://media-cdn.tripadvisor.com/media/attractions-splice-spp-720x480/0f/46/57/8d.jpg,-1,Số 8 trên 273 Phương tiện giao thông ở Thành phố Hồ Chí Minh,https://www.tripadvisor.com.vn/Attraction_Review-g293925-d24122789-Reviews-Saigonbiketours-Ho_Chi_Minh_City.html
Vietnam Tours,-1,4.5,-1,https://dynamic-media-cdn.tripadvisor.com/media/photo-o/19/7b/18/83/caption.jpg?w=1000&h=1000&s=1,-1,Số 51 trên 494 Phương tiện giao thông ở Hà Nội,https://www.tripadvisor.com.vn/Attraction_Review-g293924-d19102819-Reviews-Vietnam_Tours-Hanoi.html
Phong Nha Locals Travel & Transport,-1,4.5,-1,https://dynamic-media-cdn.tripadvisor.com/media/photo-o/0d/9a/52/65/phong-nha-cave-boat-tour.jpg?w=600&h=500&s=1,-1,Số 1 trên 10 Phương tiện giao thông ở Đồng Hới,https://www.tripadvisor.com.vn/Attraction_Review-g659924-d11798110-Reviews-Phong_Nha_Locals_Travel_Transport-Dong_Hoi_Quang_Binh_Province.html
Ninh Binh Tourist Center,-1,5.0,-1,-1,"Great service provided by Nam. He drove us around Ninh Binh, waited patiently always smiling and helpful. Without him the experience wouldn't have been the same. We'll miss you Nam, as much as we miss Vietnam!",Số 3 trên 30 Phương tiện giao thông ở Ninh Bình,https://www.tripadvisor.com.vn/Attraction_Review-g303945-d18546599-Reviews-Ninh_Binh_Tourist_Center-Ninh_Binh_Ninh_Binh_Province.html
Absolute Asia Travel,-1,5.0,-1,-1,"After researching a few agencies a year before our trip, we were won over by Tuan Dong’s level of service, professionalism and responsive to working with us to create a 3-week itinerary. He and his on-site team were wonderful from time of booking to answering questions when we were traveling within the country. If you make it out to Sapa, I recommend May Nhung in Sapa who made the entire experience memorable. She’s very hospitable, charismatic and super friendly.",Số 52 trên 494 Phương tiện giao thông ở Hà Nội,https://www.tripadvisor.com.vn/Attraction_Review-g293924-d18270893-Reviews-Absolute_Asia_Travel-Hanoi.html
Joyous Travel,-1,5.0,-1,https://dynamic-media-cdn.tripadvisor.com/media/photo-o/2a/2b/b1/ec/caption.jpg?w=1000&h=800&s=1,Nam is a very well organised tour guide and a great storyteller. Being an aspiring photographer he took a series of photos during the day and shared them with us after we returned to Saigon. We really enjoyed our trip to Mekong Delta. Thank you.,Số 11 trên 273 Phương tiện giao thông ở Thành phố Hồ Chí Minh,https://www.tripadvisor.com.vn/Attraction_Review-g293925-d24840473-Reviews-Joyous_Travel-Ho_Chi_Minh_City.html
Danang Amazing Trip Travel,-1,5.0,-1,https://media-cdn.tripadvisor.com/media/attractions-splice-spp-720x480/0f/9d/84/4f.jpg,"Our vacation in Da Nang was EXCELLENT with all the details of the trip well attended to.

They made it sure that everything was best. From accommodation, transportation and to
the food.",Số 3 trên 88 Chuyến tham quan bằng thuyền & thể thao dưới nước ở Đà Nẵng,https://www.tripadvisor.com.vn/Attraction_Review-g298085-d24973339-Reviews-Danang_Amazing_Trip_Travel-Da_Nang.html
MinMax Travel,-1,5.0,-1,https://dynamic-media-cdn.tripadvisor.com/media/photo-o/07/b6/0f/c6/vietnam-minmax-travel.jpg?w=800&h=600&s=1,"Nơi đây đúng là thiên đường của những nơi nghĩ mát, dành cho bạn bè gia đình :))) sẽ quay laij lần nữa, mà còn đi thêm nhiều nơi khác nữa",Số 48 trên 494 Phương tiện giao thông ở Hà Nội,https://www.tripadvisor.com.vn/Attraction_Review-g293924-d2402698-Reviews-Vietnam_MinMax_Travel_Day_Tours-Hanoi.html
The Church Travels,-1,5.0,-1,https://media-cdn.tripadvisor.com/media/attractions-splice-spp-720x480/06/87/8f/7c.jpg,"Bạn bán hàng nhiệt tình tư vấn , hỗ trợ chuyến đi vào huế của mình
Giá vé hợp lý. Sẽ quay lại lần tới",Số 55 trên 494 Phương tiện giao thông ở Hà Nội,https://www.tripadvisor.com.vn/Attraction_Review-g293924-d15246843-Reviews-The_Church_Travels-Hanoi.html
